{
  "id": "urn:ngsi-ld:Task:takamatsu:1234",
  "type": "Task",
  "name": "西宝町1-1 の冠水を確認する",
  "description": "通報 #12 の現地確認。水位と通行可否を報告すること。",
  "project": "urn:ngsi-ld:Project:takamatsu-flood-2026-typhoon-10",
  "parent": "urn:ngsi-ld:Task:takamatsu:1200",
  "relatedTo": [
    "urn:ngsi-ld:Task:takamatsu:1198"
  ],
  "refersTo": "urn:ngsi-ld:RoadRestriction:2026-typhoon-10-003",
  "progress": "in-process",
  "statusLabel": "対応中",
  "subtype": "現地確認",
  "priority": 2,
  "assignee": [
    "urn:ngsi-ld:Team:takamatsu:genchi-1"
  ],
  "author": "urn:ngsi-ld:Person:takamatsu:yamada",
  "start": "2026-08-21T10:30:00+09:00",
  "due": "2026-08-21T12:00:00+09:00",
  "estimatedDuration": "PT1H30M",
  "percentComplete": 40,
  "keywords": [
    "冠水",
    "巡回"
  ],
  "location": {
    "type": "Point",
    "coordinates": [
      134.0437,
      34.3403
    ]
  },
  "spatialId": [
    "/25/0/29803543/13212179"
  ],
  "isPrivate": false,
  "source": "https://tracker.example.jp/issues/1234",
  "externalId": "1234",
  "dateCreated": "2026-08-21T10:20:00+09:00",
  "dateModified": "2026-08-21T11:05:00+09:00"
}
